{"_meta":{"builtWith":"scraper/src/build.js","sites":{"bsys":13817,"fmbc":261,"gyuj":2332,"rfm":830},"songCount":14910},"collector":{"A. Pric":1,"Albert Osváth":1,"Antal Molnár":3,"Arató Kálmán":3,"Balabán Imre":48,"Balla Péter":190,"Balla Péter, Bartók Béla, Lajtha László":7,"Bartók Béla":3702,"Bartók Béláné":13,"Botos János":1,"Béla Bartók":182,"Béla Bartók Béla":1,"Béla Vikár":17,"Csiky János":9,"Cziráky László":1,"Deák Ferenc":78,"Domokos Pál Péter":88,"Domokos Pál Péter, Bartók Béla":16,"Em. Laciak":1,"Erdős László":1,"Faragó Sándor":1,"Garay Ákos":64,"Gyula Sebestyén":1,"Géza Baditcs":1,"J. Kohút":1,"Jaksich Mihály":3,"József Fárbás":1,"József Szabó":1,"K. A. Medveczký":3,"K. Szereday":1,"Karol Ruppeldt":2,"Kenesei Ilona":7,"Kerényi György":230,"Kiss Áron":23,"Kodály Zoltán":3545,"Kodály Zoltánné":317,"Kálmán Kovács":1,"Kőnig György":6,"L. Füredy":1,"Lajtha László":1243,"László Kún":1,"László Lajtha":2,"Lükő Gábor":46,"M. and K. Royová":1,"Manga János":23,"Molnár Antal":290,"Márta Ziegler":2,"O. Halaša":3,"O. Hemerka":1,"Pongrácz Zoltán":2,"Péczely Attila":576,"Rácz Ilona":29,"Sebestyén Gyula":9,"Seemayer Vilmos":1318,"Seemayer Vilmos, Bartók Béla, Lajtha László":20,"Siposs Ilona":1,"Sztankó Béla":2,"Szűcs Gyula":1,"V. Bartonek":1,"Veress Gábor":34,"Veress Sándor":295,"Vikár Béla":1593,"Vilmos Seemayer":1,"Volly István":2,"Ziegler Márta":1,"Zoltán Kodály":8,"null":729,"Ádám Jenő":100,"Ákos Garay":1,"Ľ. Vansa":2,"Š. Volf":1},"country":{"HR":1,"HU":6472,"RO":4072,"RS":2,"SK":1210,"UA":7,"null":3146},"county":{"Alba":70,"Arad":31,"Bacău":304,"Bihor":436,"Bistrița-Năsăud":1,"Brașov":32,"Békés":669,"Caraș-Severin":1,"Cluj":284,"Covasna":50,"Csongrád-Csanád":50,"Hajdú-Bihar":17,"Harghita":1359,"Hunedoara":105,"Iași":5,"Maramureș":370,"Mureș":459,"Neamț":2,"Satu Mare":82,"Suceava":351,"Szabolcs-Szatmár-Bereg":192,"Sălaj":53,"Timiș":70,"null":9917},"ethnicity":{"Hungarian":150,"Roma (printed: țigan)":69,"Romanian":804,"Slovakian":64,"null":13819,"ukrán":4},"genre":{"bocet":21,"cantec":173,"colinda":497,"doina":9,"joc":113,"null":14080,"other":17},"instrument":{"alphorn (bucium)":12,"bagpipe":3,"fluier":7,"fujara":1,"guitar":1,"null":14878,"violin":9},"performance":{"instrumental":383,"unknown":13582,"vocal":945},"region":{"Banat":75,"Bukovina":351,"Crișana":602,"Maramureș":370,"Moldavia":311,"Transylvania":2363,"null":10838},"site":{"bsys":13817,"fmbc":261,"gyuj":2,"rfm":830},"style":{"instrumental":357,"mixed style":3263,"new style":4630,"not classified":373,"null":1091,"old style":5196},"village":{"Abádszalók":1,"Acățari":16,"Albac":11,"Aleșd":1,"Apátfalva":29,"Arad":9,"Armăşeni":1,"Armășeni":10,"Bala":6,"Beiuș":5,"Bezid":12,"Bečej":1,"Bicalatu":4,"Bistra":12,"Bocicoiel":23,"Bogdan Vodă":22,"Bratislava":1,"Braväcovo":1,"Breb":9,"Brădești":2,"Budureasa":5,"Bulz":4,"Cenad":8,"Cerbăl":18,"Chetriș":8,"Chibed":26,"Chibulcut":3,"Chileni":12,"Chinciuș":12,"Cioboteni":5,"Ciumani":91,"Cleja":31,"Cluj-Napoca":5,"Cociuba Mare":2,"Cociuba-Mare":1,"Comlăușa":3,"Corbești":3,"Cornești":9,"Corund":9,"Cotiglet":16,"Cristeşti":2,"Cristuru Secuiesc":8,"Csanádapáca":1,"Csanádpalota":4,"Curtecap":10,"Câmp":3,"Cârța":20,"Căbești":1,"Călugăreni":3,"Căpâlnița":11,"Cărpiniș":2,"Dealu":16,"Delani":5,"Denta":5,"Detva":3,"Diakovce":1,"Dioșod":45,"Dornești":78,"Dragomirești":38,"Dražovce":3,"Drăgănești":7,"Dumbrăvița de Codru":7,"Dămieni":6,"Eremitu":41,"Faraoani":12,"Fehérgyarmat":4,"Feneș":5,"Feregi":7,"Filier":2,"Filier, Ratkósebes":1,"Firtuşu":1,"Firtușu":17,"Gacsály":9,"Galbeni":68,"Gemerská County":2,"Ghelari":8,"Gheorgheni":45,"Gherla":3,"Ghimeș-Făget":1,"Ginta":17,"Glod":24,"Grlica":13,"Groşi":1,"Groși":6,"Grădiște":13,"Gyula":1,"Győrtelek":9,"Găiceana":8,"Hiadeľ":2,"Hodac":1,"Hodoșa":14,"Hotărel":1,"Huedin":51,"Iacobești":20,"Idicel":19,"Ieud":71,"Igriș":15,"Ihod":19,"Ineu":29,"Inlăceni":14,"Iregszemcse":19,"Iugani":5,"Izvoru Crişului":1,"Izvoru Crișului":70,"Jelenec":1,"Jelšovce":1,"Joseni":133,"Kisar":12,"Kispalád":8,"Klátova Nová Ves":1,"Kocsord":13,"Komlódtótfalu":5,"Konyár":16,"Korođ":1,"Lapáš":1,"Lechincioara":2,"Leheceni":1,"Lespezi":22,"Libănești":7,"Liptov County":1,"Liptov megye":1,"Livezile":1,"Lopej":1,"Lueta":20,"Luizi-Călugăra":42,"Lunca de Jos":16,"Lunca de Sus":10,"Luncșoara":6,"Lupeni":5,"Medzibrod":1,"Mera":30,"Micești":6,"Micălaca":1,"Mihăileni":5,"Moișa":8,"Moneasa":1,"Mugeni":1,"Murani":6,"Mânerău":1,"Măneuți":71,"Mănăstireni":39,"Mănăștiur":3,"Mănăștur":4,"Mătrici":30,"Nearșova":10,"Nicula":1,"Nierești":14,"Nitrianska County":1,"Novohradská County":1,"Nucșoara":15,"Nușeni":1,"Nyírmeggyes":14,"Nábrád":12,"Nănești":13,"Odorheiu Secuiesc":27,"Oncești":54,"Onești":8,"Orașu Nou":71,"Orșova":11,"Otelec":2,"Petriș":3,"Petrova":19,"Petroșan":17,"Plăieșii de Jos":3,"Podkonice":3,"Poiana":1,"Poiana Vadului":1,"Poienile Izei":28,"Polonița":1,"Pomi":2,"Poniky":3,"Porcsalma":14,"Prešporská County":1,"Priechod":1,"Pădureni":2,"Păucinești":24,"Racu":45,"Rafainovo":1,"Ratkovské Bystré":3,"Recea":1,"Remetea":13,"Rimetea":9,"Rogoz":9,"Rugăneşti":1,"Rugănești":18,"Râpa de Sus":1,"Râu de Mori":17,"Salonta":270,"Sarafola":2,"Saravale":11,"Satu Mare":4,"Sebiș":3,"Seceani":3,"Selce":1,"Seleuș":1,"Somușca":3,"Sovata":16,"Suseni":72,"Szeged-Szőreg":8,"Sâmbriaş":3,"Sâmbriaș":41,"Sâmbășag":1,"Sândominic":6,"Sânnicolau Mare":12,"Sânsimion":5,"Săbăoani":2,"Săvârșin":3,"Tarna Mare":5,"Telince":1,"Tețcani":5,"Toc":2,"Tomești":32,"Toplița":2,"Troaș":5,"Tunyogmatolcs":47,"Turț":1,"Tuta":4,"Tușnad":1,"Tyukod":18,"Târgu Mureș":71,"Târgu Secuiesc":10,"Túrricse":27,"Tărcaia":35,"Tășad":5,"Unirea":10,"Urisiu de Sus":14,"Urviș de Beiuș":7,"Valea Mare":5,"Valea Seacă":86,"Valea Strâmbă":59,"Vașcău":3,"Veľký Meder":5,"Vidra":3,"Vișeu de Jos":34,"Vișăul de Jos":1,"Vlăhița":58,"Voiniceni":5,"Vornicenii Mari":49,"Văcăreşti":3,"Vălcani":3,"Văleni":33,"Vălenii":20,"Vătava":3,"Zalău":1,"Zam":33,"Zetea":30,"null":11095,"Értarcsa":1,"Čierny Balog":3,"Šahy":3,"Šarišská County":4,"Štrba":1,"Žihárec":1,"Șapartoc":1,"Șiclod":25,"Șoimi":9,"Țibeni":133,"Дeрцeн":2,"Довге":2,"Липецька Поляна":1,"Мала Копаня":1},"year":{"1865":1,"1867":2,"1880":7,"1889":3,"1890":1,"1891":1,"1892":1,"1894":1,"1896":37,"1898":73,"1899":201,"1900":61,"1901":23,"1902":137,"1903":70,"1904":39,"1905":68,"1906":1397,"1907":786,"1908":91,"1909":207,"1910":487,"1911":393,"1912":914,"1913":864,"1914":659,"1915":54,"1916":514,"1917":425,"1918":375,"1919":11,"1920":12,"1921":315,"1922":664,"1923":227,"1924":49,"1925":111,"1926":158,"1927":40,"1928":139,"1929":310,"1930":387,"1931":251,"1932":570,"1933":601,"1934":507,"1935":356,"1936":157,"1937":109,"1938":38,"1939":1,"1943":1,"null":2004}}